{
  "schemaVersion": 1,
  "formId": "futur-zwei",
  "role": "pedagogy",
  "verdict": "PASS",
  "candidateFingerprint": "f348114f5017d903e912bbaea94d9457a94d79a9228e007b6c3eaf999e962e2e",
  "harnessFingerprint": "dafbc13ddbae101d8941131b4ad30b794f0db3d92a8923d8e20f3577a2458ac3",
  "specFingerprint": "561bbcc5f629adcc03344e533987efcb73b987f9d6552097b4dd85a65181c92d",
  "promptFingerprint": "8491db8999fd7dc0484da18a98c1599e0149592d26695ea784d9d1f809115d04",
  "checks": [
    {
      "id": "coverage",
      "status": "PASS",
      "percentage": 100,
      "detail": "10 retos en cada nivel 1–5 y una historia final."
    },
    {
      "id": "originality",
      "status": "PASS",
      "percentage": 100,
      "duplicateCount": 0
    },
    {
      "id": "level-4",
      "status": "PASS",
      "percentage": 100,
      "detail": "Cinco oraciones, un error identificable y corrección explícita."
    },
    {
      "id": "level-5",
      "status": "PASS",
      "percentage": 100,
      "balance": {
        "separable": 5,
        "inseparable": 5
      },
      "maximumRun": 2,
      "detail": "Orden estable, partícula oculta y respuesta en oración completa."
    },
    {
      "id": "level-6",
      "status": "PASS",
      "percentage": 100,
      "gapCount": 10,
      "detail": "Historia continua y unidades verbales completas."
    },
    {
      "id": "inferability-and-language",
      "status": "PASS",
      "percentage": 100,
      "detail": "Los contextos hacen visible la función y la concordancia objetivo."
    }
  ],
  "findings": [],
  "generatedAt": "2026-09-05T15:33:00.951Z"
}
