{
  "schemaVersion": 1,
  "formId": "futur-eins",
  "role": "pedagogy",
  "verdict": "PASS",
  "candidateFingerprint": "8be91645c57ff32412b3210e94f09e0f7fd4fdafb6ddc14baab7351c92cb580c",
  "harnessFingerprint": "dafbc13ddbae101d8941131b4ad30b794f0db3d92a8923d8e20f3577a2458ac3",
  "specFingerprint": "d3bcddf78e68010b90bb3dac29b1f56ffa1b1ee22910723504189802809003df",
  "promptFingerprint": "8491db8999fd7dc0484da18a98c1599e0149592d26695ea784d9d1f809115d04",
  "checks": [
    {
      "id": "coverage-and-progression",
      "status": "PASS",
      "percentage": 100,
      "evidence": "10 retos en N1–N5 y una historia N6; reconocimiento, producción, escena, corrección, separación e integración aparecen en orden."
    },
    {
      "id": "clause-distribution",
      "status": "PASS",
      "percentage": 100,
      "evidence": "N2 y N3 usan el tipo de cláusula que hace inequívoca la forma; el contrato corregido no impone alternancia artificial."
    },
    {
      "id": "cross-level-originality",
      "status": "PASS",
      "percentage": 100,
      "duplicates": [],
      "evidence": "No hay textos completos idénticos entre niveles."
    },
    {
      "id": "level-4-controlled-rotation",
      "status": "PASS",
      "percentage": 100,
      "errorPositions": [
        1,
        2,
        3,
        4,
        5,
        1,
        2,
        3,
        4,
        5
      ],
      "evidence": "Cada texto contiene cinco oraciones, un solo error y las posiciones 1–5 aparecen dos veces; la rotación controlada está permitida."
    },
    {
      "id": "level-5-no-leak",
      "status": "PASS",
      "percentage": 100,
      "sequence": [
        "separable",
        "inseparable",
        "separable",
        "inseparable",
        "separable",
        "separable",
        "inseparable",
        "separable",
        "inseparable",
        "inseparable"
      ],
      "classChanges": 7,
      "longestRun": 2,
      "visibleLeaks": [],
      "evidence": "Balance 5/5, al menos seis cambios, racha máxima dos, infinitivo unido y respuesta como oración completa."
    },
    {
      "id": "level-6-integrated-story",
      "status": "PASS",
      "percentage": 100,
      "gaps": 10,
      "minimumAnswerTokens": 2,
      "evidence": "Historia continua con diez o más decisiones y la unidad exigida por la especificación en cada hueco."
    }
  ],
  "findings": [],
  "generatedAt": "2026-09-05T15:32:18.923Z"
}
